{
  "$schema": "https://json-schema.org/draft/2020-12/schema",
  "$id": "https://raw.githubusercontent.com/penrose/penrose/main/packages/examples/src/registry-schema.json",
  "title": "Penrose Registry Schema",
  "description": "Schema for the Penrose registry",
  "type": "object",
  "properties": {
    "root": {
      "type": "string",
      "description": "Root URI of the registry"
    },
    "trios": {
      "type": "array",
      "items": {
        "type": "object",
        "properties": {
          "name": {
            "type": "string",
            "description": "Human-readable name for trios"
          },
          "substance": {
            "$ref": "#/$defs/substance-key"
          },
          "style": {
            "$ref": "#/$defs/style-key"
          },
          "domain": {
            "$ref": "#/$defs/domain-key"
          },
          "variation": {
            "type": "string",
            "description": "Variation seed"
          },
          "gallery": {
            "type": "boolean",
            "description": "Whether to include in editor gallery"
          }
        },
        "required": ["substance", "style", "domain", "variation"]
      }
    },
    "domains": {
      "type": "object",
      "description": "Map of domains (key is referenced elsewhere)",
      "additionalProperties": {
        "type": "object",
        "properties": {
          "URI": {
            "$ref": "#/$defs/uri"
          }
        }
      }
    },
    "styles": {
      "type": "object",
      "description": "Map of styles (key is referenced elsewhere)",
      "additionalProperties": {
        "type": "object",
        "properties": {
          "URI": {
            "$ref": "#/$defs/uri"
          },
          "domain": {
            "$ref": "#/$defs/domain-key"
          }
        }
      }
    },
    "substances": {
      "type": "object",
      "description": "Map of substances (key is referenced elsewhere)",
      "additionalProperties": {
        "type": "object",
        "properties": {
          "URI": {
            "$ref": "#/$defs/uri"
          },
          "domain": {
            "$ref": "#/$defs/domain-key"
          }
        }
      }
    }
  },
  "required": ["root", "trios", "domains", "substances", "styles"],
  "$defs": {
    "uri": {
      "type": "string",
      "description": "relative path from the root to the file"
    },
    "domain-key": {
      "type": "string",
      "description": "key in `domains`"
    },
    "substance-key": {
      "type": "string",
      "description": "key in `substances`"
    },
    "style-key": {
      "type": "string",
      "description": "key in `styles`"
    }
  }
}
